{
  "scenario_id": "elektronik_awet_13",
  "bidang": "elektronik",
  "produk": "AC 1 PK inverter",
  "persona": {
    "tipe": "banyak_tanya",
    "emosi_awal": "penasaran"
  },
  "grounding": {
    "framework": [
      "SPIN",
      "AIDA",
      "FAB",
      "objection-handling"
    ],
    "generator": "grounded-local-v2",
    "divalidasi_manusia": false
  },
  "turns": [
    {
      "speaker": "sales",
      "text": "Halo, Bu, silakan dilihat-lihat dulu. Kalau boleh tahu, ini untuk ruang kerja di rumah atau ada kebutuhan lain?",
      "teknik": "sapa_rapport",
      "kualitas": "baik"
    },
    {
      "speaker": "pelanggan",
      "text": "Saya lagi lihat AC 1 PK inverter nih. Merk ini awet nggak? Takut cepat rusak.",
      "keberatan": "ragu_kualitas",
      "emosi": "penasaran"
    },
    {
      "speaker": "sales",
      "text": "Supaya rekomendasinya tepat, boleh saya tahu apa yang bikin Bapak/Ibu tertarik ke AC 1 PK inverter ini?",
      "teknik": "gali_kebutuhan",
      "kualitas": "baik"
    },
    {
      "speaker": "pelanggan",
      "text": "Boleh dijelaskan lebih detail?",
      "keberatan": null,
      "emosi": "netral"
    },
    {
      "speaker": "sales",
      "text": "Kalau begitu ini cocok. Sudah dilengkapi mode hemat malam yang otomatis menyesuaikan suhu. Artinya sehari-hari pemakaiannya lebih tenang.",
      "teknik": "presentasi_manfaat",
      "kualitas": "baik"
    },
    {
      "speaker": "pelanggan",
      "text": "Lumayan meyakinkan sih penjelasannya.",
      "keberatan": null,
      "emosi": "netral"
    },
    {
      "speaker": "sales",
      "text": "Boleh saya jelaskan sedikit, Bu? Asal pemakaian normal, rata-rata pelanggan kami memakainya bertahun-tahun tanpa keluhan. Jadi ini bukan sekadar klaim.",
      "teknik": "atasi_keberatan",
      "kualitas": "baik"
    },
    {
      "speaker": "pelanggan",
      "text": "Ya sudah kalau begitu.",
      "keberatan": null,
      "emosi": "tertarik"
    },
    {
      "speaker": "pelanggan",
      "text": "Cuma budget saya agak mepet sih.",
      "keberatan": "harga",
      "emosi": "ragu"
    },
    {
      "speaker": "sales",
      "text": "Saya paham kekhawatiran Bapak/Ibu. Banyak pelanggan awalnya berpikir sama, sampai tahu bahwa bisa dicicil ringan atau ada tipe yang lebih ramah budget dengan fungsi mirip.",
      "teknik": "atasi_keberatan",
      "kualitas": "baik"
    },
    {
      "speaker": "pelanggan",
      "text": "Lumayan meyakinkan sih penjelasannya.",
      "keberatan": null,
      "emosi": "netral"
    },
    {
      "speaker": "sales",
      "text": "Menurut saya ini sudah paling sesuai kebutuhan tadi. Lanjut ke langkah berikutnya, Bu?",
      "teknik": "closing",
      "kualitas": "baik"
    },
    {
      "speaker": "pelanggan",
      "text": "Sip, proses saja.",
      "keberatan": null,
      "emosi": "tertarik"
    },
    {
      "speaker": "sales",
      "text": "Supaya lebih tenang pemakaiannya, paket pasang + bracket + pipa berkualitas bisa saya bundling dengan harga lebih baik. Mau?",
      "teknik": "upsell",
      "kualitas": "baik"
    }
  ]
}