{
  "scenario_id": "otomotif_ruang_kabin_10",
  "bidang": "otomotif",
  "produk": "mobil bekas sertifikasi",
  "persona": {
    "tipe": "buru_buru",
    "emosi_awal": "tidak_sabar"
  },
  "grounding": {
    "framework": [
      "SPIN",
      "AIDA",
      "FAB",
      "objection-handling"
    ],
    "generator": "grounded-local-v2",
    "divalidasi_manusia": false
  },
  "turns": [
    {
      "speaker": "sales",
      "text": "Halo, Mbak, silakan dilihat-lihat dulu. Kalau boleh tahu, ini untuk budget terbatas tapi mau mobil layak atau ada kebutuhan lain?",
      "teknik": "sapa_rapport",
      "kualitas": "baik"
    },
    {
      "speaker": "pelanggan",
      "text": "Langsung aja ya, saya cari mobil bekas sertifikasi buat budget terbatas tapi mau mobil layak, yang bagus yang mana?",
      "keberatan": null,
      "emosi": "tidak_sabar"
    },
    {
      "speaker": "sales",
      "text": "Rencananya dipakai berapa orang biasanya? Dan lebih sering dalam kota atau jarak jauh?",
      "teknik": "gali_kebutuhan",
      "kualitas": "baik"
    },
    {
      "speaker": "pelanggan",
      "text": "Iya, terus?",
      "keberatan": null,
      "emosi": "netral"
    },
    {
      "speaker": "sales",
      "text": "Keunggulan utamanya yang relevan buat Bapak/Ibu begini: unit sudah lolos inspeksi 150 titik dan bergaransi mesin 1 tahun dari kami.",
      "teknik": "presentasi_manfaat",
      "kualitas": "baik"
    },
    {
      "speaker": "pelanggan",
      "text": "Kalau bawa barang banyak, bagasinya mepet nggak?",
      "keberatan": "tidak_butuh",
      "emosi": "ragu"
    },
    {
      "speaker": "sales",
      "text": "Terima kasih sudah jujur, Mbak. Nah, kursinya bisa dikonfigurasi, jadi fleksibel antara muat orang atau muat barang, jadi bisa lebih tenang mempertimbangkannya.",
      "teknik": "atasi_keberatan",
      "kualitas": "baik"
    },
    {
      "speaker": "pelanggan",
      "text": "Oke oke, paham. Lanjut.",
      "keberatan": null,
      "emosi": "tertarik"
    },
    {
      "speaker": "sales",
      "text": "Kalau ini cocok, saya bisa langsung siapkan untuk hari ini juga, Mbak. Mau saya proseskan?",
      "teknik": "closing",
      "kualitas": "baik"
    },
    {
      "speaker": "pelanggan",
      "text": "Oke cepetan proses ya.",
      "keberatan": null,
      "emosi": "tertarik"
    },
    {
      "speaker": "sales",
      "text": "Kalau berkenan, paket detailing + ganti oli menyeluruh ini pas dengan kebutuhan Bapak/Ibu tadi, bikin lebih worth it. Saya masukkan ya?",
      "teknik": "upsell",
      "kualitas": "baik"
    }
  ]
}