{
  "scenario_id": "otomotif_dp_cicilan_11",
  "bidang": "otomotif",
  "produk": "LCGC 1.000cc",
  "persona": {
    "tipe": "cuma_lihat",
    "emosi_awal": "santai"
  },
  "grounding": {
    "framework": [
      "SPIN",
      "AIDA",
      "FAB",
      "objection-handling"
    ],
    "generator": "grounded-local-v2",
    "divalidasi_manusia": false
  },
  "turns": [
    {
      "speaker": "sales",
      "text": "Selamat datang, Mas. Lagi cari LCGC 1.000cc untuk keperluan apa? Biar saya bantu carikan yang pas.",
      "teknik": "sapa_rapport",
      "kualitas": "baik"
    },
    {
      "speaker": "pelanggan",
      "text": "Ini lagi lihat-lihat LCGC 1.000cc yang cocok untuk antar-jemput anak sekolah.",
      "keberatan": null,
      "emosi": "santai"
    },
    {
      "speaker": "sales",
      "text": "Ada pengalaman kurang enak dengan produk sebelumnya? Biar yang ini benar-benar menjawab kebutuhannya.",
      "teknik": "gali_kebutuhan",
      "kualitas": "baik"
    },
    {
      "speaker": "pelanggan",
      "text": "Hmm, oke.",
      "keberatan": null,
      "emosi": "netral"
    },
    {
      "speaker": "sales",
      "text": "Dibanding pilihan lain, nilai lebih LCGC 1.000cc ada di sini: harga on the road-nya paling terjangkau di kelasnya, cocok untuk mobil pertama.",
      "teknik": "presentasi_manfaat",
      "kualitas": "baik"
    },
    {
      "speaker": "pelanggan",
      "text": "DP-nya berat ya, cicilan per bulan berapa?",
      "keberatan": "harga",
      "emosi": "ragu"
    },
    {
      "speaker": "sales",
      "text": "Terima kasih sudah jujur, Mas. Nah, tenornya bisa disesuaikan dengan kemampuan bulanan Bapak/Ibu, tidak harus dipaksakan, jadi bisa lebih tenang mempertimbangkannya.",
      "teknik": "atasi_keberatan",
      "kualitas": "baik"
    },
    {
      "speaker": "pelanggan",
      "text": "Lumayan meyakinkan sih penjelasannya.",
      "keberatan": null,
      "emosi": "tertarik"
    },
    {
      "speaker": "sales",
      "text": "Unitnya kebetulan masih ready. Mau saya amankan dulu untuk Bapak/Ibu?",
      "teknik": "closing",
      "kualitas": "baik"
    },
    {
      "speaker": "pelanggan",
      "text": "Oke deh, saya pikirkan serius nih jadinya.",
      "keberatan": null,
      "emosi": "tertarik"
    }
  ]
}