{
  "scenario_id": "otomotif_ruang_kabin_11",
  "bidang": "otomotif",
  "produk": "LCGC 1.000cc",
  "persona": {
    "tipe": "sensitif_harga",
    "emosi_awal": "hati_hati"
  },
  "grounding": {
    "framework": [
      "SPIN",
      "AIDA",
      "FAB",
      "objection-handling"
    ],
    "generator": "grounded-local-v2",
    "divalidasi_manusia": false
  },
  "turns": [
    {
      "speaker": "sales",
      "text": "Halo Pak, apa kabar? Silakan, kalau ada yang menarik nanti saya jelaskan detailnya ya.",
      "teknik": "sapa_rapport",
      "kualitas": "baik"
    },
    {
      "speaker": "pelanggan",
      "text": "Saya lagi lihat LCGC 1.000cc nih. Kalau bawa barang banyak, bagasinya mepet nggak?",
      "keberatan": "tidak_butuh",
      "emosi": "hati_hati"
    },
    {
      "speaker": "sales",
      "text": "Yang penting beli dulu, nanti juga terbiasa sendiri.",
      "teknik": "gali_kebutuhan",
      "kualitas": "lemah"
    },
    {
      "speaker": "pelanggan",
      "text": "Iya, terus?",
      "keberatan": null,
      "emosi": "netral"
    },
    {
      "speaker": "sales",
      "text": "Yang bikin LCGC 1.000cc ini menonjol, harga on the road-nya paling terjangkau di kelasnya, cocok untuk mobil pertama, dan itu yang paling terasa manfaatnya di pemakaian harian.",
      "teknik": "presentasi_manfaat",
      "kualitas": "baik"
    },
    {
      "speaker": "pelanggan",
      "text": "Oh begitu ya, oke masuk akal.",
      "keberatan": null,
      "emosi": "netral"
    },
    {
      "speaker": "sales",
      "text": "Terima kasih sudah jujur, Pak. Nah, coba Bapak/Ibu duduk sendiri di baris belakang, ternyata ruang kakinya masih lega, jadi bisa lebih tenang mempertimbangkannya.",
      "teknik": "atasi_keberatan",
      "kualitas": "baik"
    },
    {
      "speaker": "pelanggan",
      "text": "Oke deh, itu poin yang bagus.",
      "keberatan": null,
      "emosi": "tertarik"
    },
    {
      "speaker": "pelanggan",
      "text": "Harganya masih di atas rencana saya nih.",
      "keberatan": "harga",
      "emosi": "ragu"
    },
    {
      "speaker": "sales",
      "text": "Wajar banget dipikirkan. Kenyataannya, bisa dicicil ringan atau ada tipe yang lebih ramah budget dengan fungsi mirip, dan itu bisa Bapak/Ibu buktikan sendiri.",
      "teknik": "atasi_keberatan",
      "kualitas": "baik"
    },
    {
      "speaker": "pelanggan",
      "text": "Lumayan meyakinkan sih penjelasannya.",
      "keberatan": null,
      "emosi": "netral"
    },
    {
      "speaker": "sales",
      "text": "Menurut saya ini sudah paling sesuai kebutuhan tadi. Lanjut ke langkah berikutnya, Pak?",
      "teknik": "closing",
      "kualitas": "baik"
    },
    {
      "speaker": "pelanggan",
      "text": "Yaudah kalau cicilannya masuk, saya jadi.",
      "keberatan": null,
      "emosi": "tertarik"
    }
  ]
}