{
  "scenario_id": "otomotif_konsultasi_pasangan_13",
  "bidang": "otomotif",
  "produk": "SUV compact",
  "persona": {
    "tipe": "cuma_lihat",
    "emosi_awal": "santai"
  },
  "grounding": {
    "framework": [
      "SPIN",
      "AIDA",
      "FAB",
      "objection-handling"
    ],
    "generator": "grounded-local-v2",
    "divalidasi_manusia": false
  },
  "turns": [
    {
      "speaker": "sales",
      "text": "Selamat siang, Bu. Silakan, ada yang bisa saya bantu? Lagi cari yang seperti apa nih?",
      "teknik": "sapa_rapport",
      "kualitas": "baik"
    },
    {
      "speaker": "pelanggan",
      "text": "Sebenarnya cuma lihat-lihat sih, tapi mungkin butuh SUV compact buat gaya harian tapi sesekali luar kota.",
      "keberatan": null,
      "emosi": "santai"
    },
    {
      "speaker": "sales",
      "text": "Yang paling penting buat Bapak/Ibu apa nih, gaya harian tapi sesekali luar kota, hemat biaya, atau kenyamanan? Biar saya prioritaskan.",
      "teknik": "gali_kebutuhan",
      "kualitas": "baik"
    },
    {
      "speaker": "pelanggan",
      "text": "Boleh, lanjut.",
      "keberatan": null,
      "emosi": "netral"
    },
    {
      "speaker": "sales",
      "text": "Ini SUV compact paling canggih, fiturnya dari A sampai Z ada, semua orang suka, bagus deh pokoknya.",
      "teknik": "presentasi_manfaat",
      "kualitas": "lemah"
    },
    {
      "speaker": "pelanggan",
      "text": "Nanti saya tanya suami saya dulu deh.",
      "keberatan": "mau_pikir_pikir",
      "emosi": "ragu"
    },
    {
      "speaker": "sales",
      "text": "Betul, Bu, wajar kalau ragu. Tapi begini: boleh banget, biar mantap saya siapkan ringkasan spesifikasi dan simulasi biaya untuk dibawa pulang. Gimana, sudah lebih jelas?",
      "teknik": "atasi_keberatan",
      "kualitas": "baik"
    },
    {
      "speaker": "pelanggan",
      "text": "Ya sudah kalau begitu.",
      "keberatan": null,
      "emosi": "tertarik"
    },
    {
      "speaker": "sales",
      "text": "Biar pas, Bapak/Ibu lebih nyaman ambil yang ini atau yang tadi satunya? Saya siapkan yang dipilih.",
      "teknik": "closing",
      "kualitas": "baik"
    },
    {
      "speaker": "pelanggan",
      "text": "Oke deh, saya pikirkan serius nih jadinya.",
      "keberatan": null,
      "emosi": "tertarik"
    },
    {
      "speaker": "sales",
      "text": "Kalau berkenan, roof rack untuk barang touring ini pas dengan kebutuhan Bapak/Ibu tadi, bikin lebih worth it. Saya masukkan ya?",
      "teknik": "upsell",
      "kualitas": "baik"
    }
  ]
}