{
  "scenario_id": "elektronik_awet_12",
  "bidang": "elektronik",
  "produk": "mesin cuci front-loading",
  "persona": {
    "tipe": "sensitif_harga",
    "emosi_awal": "hati_hati"
  },
  "grounding": {
    "framework": [
      "SPIN",
      "AIDA",
      "FAB",
      "objection-handling"
    ],
    "generator": "grounded-local-v2",
    "divalidasi_manusia": false
  },
  "turns": [
    {
      "speaker": "sales",
      "text": "Mari, Bu, silakan masuk. Kebetulan pas banget, boleh saya temani lihat-lihat mesin cuci front-loading-nya?",
      "teknik": "sapa_rapport",
      "kualitas": "baik"
    },
    {
      "speaker": "pelanggan",
      "text": "Saya lagi lihat mesin cuci front-loading nih. Saya pernah kapok beli yang cepat rusak.",
      "keberatan": "ragu_kualitas",
      "emosi": "hati_hati"
    },
    {
      "speaker": "sales",
      "text": "Yang paling penting buat Bapak/Ibu apa nih, keluarga dengan cucian menumpuk, hemat biaya, atau kenyamanan? Biar saya prioritaskan.",
      "teknik": "gali_kebutuhan",
      "kualitas": "baik"
    },
    {
      "speaker": "pelanggan",
      "text": "Iya, betul.",
      "keberatan": null,
      "emosi": "netral"
    },
    {
      "speaker": "sales",
      "text": "Nah untuk kebutuhan tadi, mesin cuci front-loading ini pas: putaran pengeringnya kencang, jemuran jadi cepat kering meski mendung. Jadi langsung menjawab yang Bapak/Ibu butuhkan.",
      "teknik": "presentasi_manfaat",
      "kualitas": "baik"
    },
    {
      "speaker": "pelanggan",
      "text": "Lumayan meyakinkan sih penjelasannya.",
      "keberatan": null,
      "emosi": "netral"
    },
    {
      "speaker": "sales",
      "text": "Pertanyaan yang bagus, Bu. Justru di situ bedanya: asal pemakaian normal, rata-rata pelanggan kami memakainya bertahun-tahun tanpa keluhan.",
      "teknik": "atasi_keberatan",
      "kualitas": "baik"
    },
    {
      "speaker": "pelanggan",
      "text": "Ya sudah kalau begitu.",
      "keberatan": null,
      "emosi": "tertarik"
    },
    {
      "speaker": "sales",
      "text": "Kalau ini cocok, saya bisa langsung siapkan untuk hari ini juga, Bu. Mau saya proseskan?",
      "teknik": "closing",
      "kualitas": "baik"
    },
    {
      "speaker": "pelanggan",
      "text": "Oke, kalau harganya segitu saya ambil.",
      "keberatan": null,
      "emosi": "tertarik"
    }
  ]
}