{
  "scenario_id": "otomotif_konsultasi_pasangan_06",
  "bidang": "otomotif",
  "produk": "LCGC 1.000cc",
  "persona": {
    "tipe": "loyal_merk_lain",
    "emosi_awal": "defensif"
  },
  "grounding": {
    "framework": [
      "SPIN",
      "AIDA",
      "FAB",
      "objection-handling"
    ],
    "generator": "grounded-local-v2",
    "divalidasi_manusia": false
  },
  "turns": [
    {
      "speaker": "sales",
      "text": "Selamat datang, Pak. Lagi cari LCGC 1.000cc untuk keperluan apa? Biar saya bantu carikan yang pas.",
      "teknik": "sapa_rapport",
      "kualitas": "baik"
    },
    {
      "speaker": "pelanggan",
      "text": "Saya lagi lihat LCGC 1.000cc nih. Mau mikir-mikir dan omongin dulu di rumah.",
      "keberatan": "mau_pikir_pikir",
      "emosi": "defensif"
    },
    {
      "speaker": "sales",
      "text": "Sebelum saya sarankan, boleh saya tanya kebutuhannya dulu? Ini lebih ke mobil pertama keluarga muda, atau ada prioritas lain?",
      "teknik": "gali_kebutuhan",
      "kualitas": "baik"
    },
    {
      "speaker": "pelanggan",
      "text": "Oke saya dengerin.",
      "keberatan": null,
      "emosi": "netral"
    },
    {
      "speaker": "sales",
      "text": "Kalau begitu ini cocok. Bodinya ringkas jadi lincah dan gampang parkir di gang sempit atau mal penuh. Artinya sehari-hari pemakaiannya lebih tenang.",
      "teknik": "presentasi_manfaat",
      "kualitas": "baik"
    },
    {
      "speaker": "pelanggan",
      "text": "Oke, mulai kepikiran juga sih.",
      "keberatan": null,
      "emosi": "netral"
    },
    {
      "speaker": "sales",
      "text": "Saya paham kekhawatiran Bapak/Ibu. Banyak pelanggan awalnya berpikir sama, sampai tahu bahwa wajar kok, keputusan begini memang enaknya dibicarakan; saya kirimkan detailnya lewat WhatsApp ya.",
      "teknik": "atasi_keberatan",
      "kualitas": "baik"
    },
    {
      "speaker": "pelanggan",
      "text": "Hmm, beda juga ya ternyata.",
      "keberatan": null,
      "emosi": "tertarik"
    },
    {
      "speaker": "sales",
      "text": "Menurut saya ini sudah paling sesuai kebutuhan tadi. Lanjut ke langkah berikutnya, Pak?",
      "teknik": "closing",
      "kualitas": "baik"
    },
    {
      "speaker": "pelanggan",
      "text": "Boleh, kita lanjut.",
      "keberatan": null,
      "emosi": "tertarik"
    }
  ]
}