{
  "scenario_id": "elektronik_spek_bingung_05",
  "bidang": "elektronik",
  "produk": "kulkas 2 pintu",
  "persona": {
    "tipe": "skeptis",
    "emosi_awal": "ragu"
  },
  "grounding": {
    "framework": [
      "SPIN",
      "AIDA",
      "FAB",
      "objection-handling"
    ],
    "generator": "grounded-local-v2",
    "divalidasi_manusia": false
  },
  "turns": [
    {
      "speaker": "sales",
      "text": "Selamat datang. Lagi cari kulkas 2 pintu nih, Bu? Biar tidak salah pilih, saya bantu sesuaikan dengan kebutuhannya ya.",
      "teknik": "sapa_rapport",
      "kualitas": "baik"
    },
    {
      "speaker": "pelanggan",
      "text": "Saya lagi lihat kulkas 2 pintu nih. Saya bingung bedanya sama yang tipe satunya.",
      "keberatan": "mau_pikir_pikir",
      "emosi": "ragu"
    },
    {
      "speaker": "sales",
      "text": "Sekarang lagi pakai yang seperti apa? Ada yang kurang sreg dari yang sekarang, biar saya carikan solusinya?",
      "teknik": "gali_kebutuhan",
      "kualitas": "baik"
    },
    {
      "speaker": "pelanggan",
      "text": "Hmm, masa sih?",
      "keberatan": null,
      "emosi": "netral"
    },
    {
      "speaker": "sales",
      "text": "Keunggulan utamanya yang relevan buat Bapak/Ibu begini: pintunya rapat dan ada mode hemat, dinginnya awet meski sering dibuka-tutup.",
      "teknik": "presentasi_manfaat",
      "kualitas": "baik"
    },
    {
      "speaker": "pelanggan",
      "text": "Hmm, tapi beneran ya?",
      "keberatan": null,
      "emosi": "netral"
    },
    {
      "speaker": "sales",
      "text": "Wajar banget dipikirkan. Kenyataannya, biar gampang, saya cocokkan langsung dengan kebutuhan yang tadi Bapak/Ibu sebutkan, dan itu bisa Bapak/Ibu buktikan sendiri.",
      "teknik": "atasi_keberatan",
      "kualitas": "baik"
    },
    {
      "speaker": "pelanggan",
      "text": "Yaudah coba lihat dulu deh buktinya.",
      "keberatan": null,
      "emosi": "tertarik"
    },
    {
      "speaker": "sales",
      "text": "Biar pas, Bapak/Ibu lebih nyaman ambil yang ini atau yang tadi satunya? Saya siapkan yang dipilih.",
      "teknik": "closing",
      "kualitas": "baik"
    },
    {
      "speaker": "pelanggan",
      "text": "Yaudah kalau begitu saya jadi.",
      "keberatan": null,
      "emosi": "tertarik"
    },
    {
      "speaker": "sales",
      "text": "Satu lagi yang biasanya berguna: layanan antar plus buang kulkas lama gratis. Sifatnya opsional, tapi sayang kalau nanti nyari terpisah.",
      "teknik": "upsell",
      "kualitas": "baik"
    }
  ]
}