{
  "scenario_id": "elektronik_garansi_16",
  "bidang": "elektronik",
  "produk": "TV LED 43 inch",
  "persona": {
    "tipe": "loyal_merk_lain",
    "emosi_awal": "defensif"
  },
  "grounding": {
    "framework": [
      "SPIN",
      "AIDA",
      "FAB",
      "objection-handling"
    ],
    "generator": "grounded-local-v2",
    "divalidasi_manusia": false
  },
  "turns": [
    {
      "speaker": "sales",
      "text": "Selamat datang, Mas. Lagi cari TV LED 43 inch untuk keperluan apa? Biar saya bantu carikan yang pas.",
      "teknik": "sapa_rapport",
      "kualitas": "baik"
    },
    {
      "speaker": "pelanggan",
      "text": "Lagi butuh TV LED 43 inch nih, buat upgrade dari TV tabung lama.",
      "keberatan": null,
      "emosi": "defensif"
    },
    {
      "speaker": "sales",
      "text": "Supaya rekomendasinya tepat, boleh saya tahu apa yang bikin Bapak/Ibu tertarik ke TV LED 43 inch ini?",
      "teknik": "gali_kebutuhan",
      "kualitas": "baik"
    },
    {
      "speaker": "pelanggan",
      "text": "Boleh, lanjut.",
      "keberatan": null,
      "emosi": "netral"
    },
    {
      "speaker": "sales",
      "text": "TV LED 43 inch ini speknya tinggi, prosesornya kencang, layarnya bagus, fiturnya lengkap semua pokoknya.",
      "teknik": "presentasi_manfaat",
      "kualitas": "lemah"
    },
    {
      "speaker": "pelanggan",
      "text": "Sparepart-nya dijamin ada nggak kalau perlu ganti?",
      "keberatan": "ragu_kualitas",
      "emosi": "ragu"
    },
    {
      "speaker": "sales",
      "text": "Boleh saya jelaskan sedikit, Mas? Kartu garansinya kami aktifkan langsung atas nama bapak/ibu, jadi aman kalau ada apa-apa. Jadi ini bukan sekadar klaim.",
      "teknik": "atasi_keberatan",
      "kualitas": "baik"
    },
    {
      "speaker": "pelanggan",
      "text": "Oke, mulai kepikiran juga sih.",
      "keberatan": null,
      "emosi": "tertarik"
    },
    {
      "speaker": "sales",
      "text": "Kalau ini cocok, saya bisa langsung siapkan untuk hari ini juga, Mas. Mau saya proseskan?",
      "teknik": "closing",
      "kualitas": "baik"
    },
    {
      "speaker": "pelanggan",
      "text": "Oke, saya mau yang ini.",
      "keberatan": null,
      "emosi": "tertarik"
    },
    {
      "speaker": "sales",
      "text": "Kalau berkenan, soundbar biar suara film lebih menggelegar ini pas dengan kebutuhan Bapak/Ibu tadi, bikin lebih worth it. Saya masukkan ya?",
      "teknik": "upsell",
      "kualitas": "baik"
    }
  ]
}