{
  "scenario_id": "otomotif_ruang_kabin_21",
  "bidang": "otomotif",
  "produk": "LCGC 1.000cc",
  "persona": {
    "tipe": "skeptis",
    "emosi_awal": "ragu"
  },
  "grounding": {
    "framework": [
      "SPIN",
      "AIDA",
      "FAB",
      "objection-handling"
    ],
    "generator": "grounded-local-v2",
    "divalidasi_manusia": false
  },
  "turns": [
    {
      "speaker": "sales",
      "text": "Selamat datang, Bu. Lagi cari LCGC 1.000cc untuk keperluan apa? Biar saya bantu carikan yang pas.",
      "teknik": "sapa_rapport",
      "kualitas": "baik"
    },
    {
      "speaker": "pelanggan",
      "text": "Iya saya lagi cari LCGC 1.000cc buat antar-jemput anak sekolah.",
      "keberatan": null,
      "emosi": "ragu"
    },
    {
      "speaker": "sales",
      "text": "Boleh tahu biasanya dipakai untuk apa? Dan kira-kira sehari seberapa sering?",
      "teknik": "gali_kebutuhan",
      "kualitas": "baik"
    },
    {
      "speaker": "pelanggan",
      "text": "Boleh, lanjut.",
      "keberatan": null,
      "emosi": "netral"
    },
    {
      "speaker": "sales",
      "text": "Dibanding pilihan lain, nilai lebih LCGC 1.000cc ada di sini: mesin 1.000cc-nya irit, rata-rata pemilik kami dapat 18-20 km/liter dalam kota.",
      "teknik": "presentasi_manfaat",
      "kualitas": "baik"
    },
    {
      "speaker": "pelanggan",
      "text": "Kalau bawa barang banyak, bagasinya mepet nggak?",
      "keberatan": "tidak_butuh",
      "emosi": "ragu"
    },
    {
      "speaker": "sales",
      "text": "Saya mengerti maksud Bapak/Ibu. Izinkan saya luruskan: coba Bapak/Ibu duduk sendiri di baris belakang, ternyata ruang kakinya masih lega.",
      "teknik": "atasi_keberatan",
      "kualitas": "baik"
    },
    {
      "speaker": "pelanggan",
      "text": "Yaudah coba lihat dulu deh buktinya.",
      "keberatan": null,
      "emosi": "tertarik"
    },
    {
      "speaker": "sales",
      "text": "Kalau ini cocok, saya bisa langsung siapkan untuk hari ini juga, Bu. Mau saya proseskan?",
      "teknik": "closing",
      "kualitas": "baik"
    },
    {
      "speaker": "pelanggan",
      "text": "Sip, proses saja.",
      "keberatan": null,
      "emosi": "tertarik"
    },
    {
      "speaker": "sales",
      "text": "Biar makin lengkap, banyak pelanggan menambahkan aksesori pelindung bodi. Mau saya siapkan sekalian?",
      "teknik": "upsell",
      "kualitas": "baik"
    }
  ]
}