{
  "scenario_id": "elektronik_awet_17",
  "bidang": "elektronik",
  "produk": "mesin cuci front-loading",
  "persona": {
    "tipe": "buru_buru",
    "emosi_awal": "tidak_sabar"
  },
  "grounding": {
    "framework": [
      "SPIN",
      "AIDA",
      "FAB",
      "objection-handling"
    ],
    "generator": "grounded-local-v2",
    "divalidasi_manusia": false
  },
  "turns": [
    {
      "speaker": "sales",
      "text": "Selamat siang, Pak. Perkenalkan saya Rizky. Boleh tahu ini untuk dipakai sendiri atau untuk keluarga?",
      "teknik": "sapa_rapport",
      "kualitas": "baik"
    },
    {
      "speaker": "pelanggan",
      "text": "Saya lagi lihat mesin cuci front-loading nih. Jangan-jangan setahun sudah rewel.",
      "keberatan": "ragu_kualitas",
      "emosi": "tidak_sabar"
    },
    {
      "speaker": "sales",
      "text": "Sebelum saya sarankan, boleh saya tanya kebutuhannya dulu? Ini lebih ke keluarga dengan cucian menumpuk, atau ada prioritas lain?",
      "teknik": "gali_kebutuhan",
      "kualitas": "baik"
    },
    {
      "speaker": "pelanggan",
      "text": "Oh begitu.",
      "keberatan": null,
      "emosi": "netral"
    },
    {
      "speaker": "sales",
      "text": "Nah untuk kebutuhan tadi, mesin cuci front-loading ini pas: ada mode cepat 15 menit dan fitur pengering, praktis banget saat musim hujan. Jadi langsung menjawab yang Bapak/Ibu butuhkan.",
      "teknik": "presentasi_manfaat",
      "kualitas": "baik"
    },
    {
      "speaker": "pelanggan",
      "text": "Oke oke, paham. Lanjut.",
      "keberatan": null,
      "emosi": "netral"
    },
    {
      "speaker": "sales",
      "text": "Saya paham kekhawatiran Bapak/Ibu. Banyak pelanggan awalnya berpikir sama, sampai tahu bahwa komponen utamanya bergaransi panjang, itu bentuk keyakinan pabrik terhadap keawetannya.",
      "teknik": "atasi_keberatan",
      "kualitas": "baik"
    },
    {
      "speaker": "pelanggan",
      "text": "Oke oke, paham. Lanjut.",
      "keberatan": null,
      "emosi": "tertarik"
    },
    {
      "speaker": "sales",
      "text": "Biar pas, Bapak/Ibu lebih nyaman ambil yang ini atau yang tadi satunya? Saya siapkan yang dipilih.",
      "teknik": "closing",
      "kualitas": "baik"
    },
    {
      "speaker": "pelanggan",
      "text": "Oke cepetan proses ya.",
      "keberatan": null,
      "emosi": "tertarik"
    },
    {
      "speaker": "sales",
      "text": "Sekalian, mau saya tambahkan stacking kit + tutup pelindung? Lumayan buat jaga-jaga dan menambah kenyamanan, cuma sedikit tambahan.",
      "teknik": "upsell",
      "kualitas": "baik"
    }
  ]
}