{
  "scenario_id": "elektronik_lihat_lihat_25",
  "bidang": "elektronik",
  "produk": "kulkas 2 pintu",
  "persona": {
    "tipe": "cuma_lihat",
    "emosi_awal": "santai"
  },
  "grounding": {
    "framework": [
      "SPIN",
      "AIDA",
      "FAB",
      "objection-handling"
    ],
    "generator": "grounded-local-v2",
    "divalidasi_manusia": false
  },
  "turns": [
    {
      "speaker": "sales",
      "text": "Halo, Mas, silakan dilihat-lihat dulu. Kalau boleh tahu, ini untuk usaha katering rumahan atau ada kebutuhan lain?",
      "teknik": "sapa_rapport",
      "kualitas": "baik"
    },
    {
      "speaker": "pelanggan",
      "text": "Saya tertarik sama kulkas 2 pintu ini, kebetulan lagi perlu untuk usaha katering rumahan.",
      "keberatan": null,
      "emosi": "santai"
    },
    {
      "speaker": "sales",
      "text": "Boleh tahu biasanya dipakai untuk apa? Dan kira-kira sehari seberapa sering?",
      "teknik": "gali_kebutuhan",
      "kualitas": "baik"
    },
    {
      "speaker": "pelanggan",
      "text": "Iya, betul.",
      "keberatan": null,
      "emosi": "netral"
    },
    {
      "speaker": "sales",
      "text": "Coba saya jelaskan yang paling nyambung dengan kebutuhan tadi: kapasitasnya besar, stok belanjaan sebulan pun tertata rapi.",
      "teknik": "presentasi_manfaat",
      "kualitas": "baik"
    },
    {
      "speaker": "pelanggan",
      "text": "Santai aja dulu, lagi survei harga.",
      "keberatan": "cuma_lihat_lihat",
      "emosi": "ragu"
    },
    {
      "speaker": "sales",
      "text": "Saya paham kekhawatiran Bapak/Ibu. Banyak pelanggan awalnya berpikir sama, sampai tahu bahwa santai saja, saya temani sebentar biar kalau nanti butuh, Bapak/Ibu sudah punya bayangan.",
      "teknik": "atasi_keberatan",
      "kualitas": "baik"
    },
    {
      "speaker": "pelanggan",
      "text": "Lumayan meyakinkan sih penjelasannya.",
      "keberatan": null,
      "emosi": "tertarik"
    },
    {
      "speaker": "sales",
      "text": "Unitnya kebetulan masih ready. Mau saya amankan dulu untuk Bapak/Ibu?",
      "teknik": "closing",
      "kualitas": "baik"
    },
    {
      "speaker": "pelanggan",
      "text": "Menarik juga, boleh saya pertimbangkan dengan serius.",
      "keberatan": null,
      "emosi": "tertarik"
    }
  ]
}