{
  "scenario_id": "otomotif_bandingkan_merk_03",
  "bidang": "otomotif",
  "produk": "SUV compact",
  "persona": {
    "tipe": "loyal_merk_lain",
    "emosi_awal": "defensif"
  },
  "grounding": {
    "framework": [
      "SPIN",
      "AIDA",
      "FAB",
      "objection-handling"
    ],
    "generator": "grounded-local-v2",
    "divalidasi_manusia": false
  },
  "turns": [
    {
      "speaker": "sales",
      "text": "Mau beli apa? Ini SUV compact-nya lagi promo, ambil aja mumpung murah.",
      "teknik": "sapa_rapport",
      "kualitas": "lemah"
    },
    {
      "speaker": "pelanggan",
      "text": "Saya tertarik sama SUV compact ini, kebetulan lagi perlu untuk kerja lapangan.",
      "keberatan": null,
      "emosi": "defensif"
    },
    {
      "speaker": "sales",
      "text": "Nggak usah banyak mikir, SUV compact ini semua orang cocok kok.",
      "teknik": "gali_kebutuhan",
      "kualitas": "lemah"
    },
    {
      "speaker": "pelanggan",
      "text": "Hmm, oke.",
      "keberatan": null,
      "emosi": "netral"
    },
    {
      "speaker": "sales",
      "text": "Nah untuk kebutuhan tadi, SUV compact ini pas: posisi duduknya tinggi jadi pandangan luas dan lebih santai saat macet panjang. Jadi langsung menjawab yang Bapak/Ibu butuhkan.",
      "teknik": "presentasi_manfaat",
      "kualitas": "baik"
    },
    {
      "speaker": "pelanggan",
      "text": "Kalau dibanding merk sebelah kok lebih mahal?",
      "keberatan": "bandingkan_kompetitor",
      "emosi": "ragu"
    },
    {
      "speaker": "sales",
      "text": "Percaya saja sama saya, dijamin tidak nyesel, sudah banyak yang beli.",
      "teknik": "atasi_keberatan",
      "kualitas": "lemah"
    },
    {
      "speaker": "pelanggan",
      "text": "Oke, mulai kepikiran juga sih.",
      "keberatan": null,
      "emosi": "tertarik"
    },
    {
      "speaker": "sales",
      "text": "Menurut saya ini sudah paling sesuai kebutuhan tadi. Lanjut ke langkah berikutnya, Kak?",
      "teknik": "closing",
      "kualitas": "baik"
    },
    {
      "speaker": "pelanggan",
      "text": "Yaudah kalau begitu saya jadi.",
      "keberatan": null,
      "emosi": "tertarik"
    },
    {
      "speaker": "sales",
      "text": "Tambahin ban serep berkualitas + tools juga ya, biar tokonya untung sedikit.",
      "teknik": "upsell",
      "kualitas": "lemah"
    }
  ]
}