{
  "scenario_id": "elektronik_lihat_lihat_10",
  "bidang": "elektronik",
  "produk": "kulkas 2 pintu",
  "persona": {
    "tipe": "sensitif_harga",
    "emosi_awal": "hati_hati"
  },
  "grounding": {
    "framework": [
      "SPIN",
      "AIDA",
      "FAB",
      "objection-handling"
    ],
    "generator": "grounded-local-v2",
    "divalidasi_manusia": false
  },
  "turns": [
    {
      "speaker": "sales",
      "text": "Halo, Bu, silakan dilihat-lihat dulu. Kalau boleh tahu, ini untuk keluarga yang belanja stok mingguan atau ada kebutuhan lain?",
      "teknik": "sapa_rapport",
      "kualitas": "baik"
    },
    {
      "speaker": "pelanggan",
      "text": "Iya saya lagi cari kulkas 2 pintu buat keluarga yang belanja stok mingguan.",
      "keberatan": null,
      "emosi": "hati_hati"
    },
    {
      "speaker": "sales",
      "text": "Yang paling penting buat Bapak/Ibu apa nih, keluarga yang belanja stok mingguan, hemat biaya, atau kenyamanan? Biar saya prioritaskan.",
      "teknik": "gali_kebutuhan",
      "kualitas": "baik"
    },
    {
      "speaker": "pelanggan",
      "text": "Oh begitu.",
      "keberatan": null,
      "emosi": "netral"
    },
    {
      "speaker": "sales",
      "text": "Yang bikin kulkas 2 pintu ini menonjol, rak kacanya kuat menahan beban dan ada laci sayur khusus biar sayur tetap segar, dan itu yang paling terasa manfaatnya di pemakaian harian.",
      "teknik": "presentasi_manfaat",
      "kualitas": "baik"
    },
    {
      "speaker": "pelanggan",
      "text": "Belum ada rencana beli sekarang, sekadar lihat model.",
      "keberatan": "cuma_lihat_lihat",
      "emosi": "hati_hati"
    },
    {
      "speaker": "sales",
      "text": "Jangan ragu Bu, pokoknya bagus. Ambil aja dulu deh.",
      "teknik": "atasi_keberatan",
      "kualitas": "lemah"
    },
    {
      "speaker": "pelanggan",
      "text": "Oke deh, itu poin yang bagus.",
      "keberatan": null,
      "emosi": "tertarik"
    },
    {
      "speaker": "pelanggan",
      "text": "Tapi tetap agak mahal ya.",
      "keberatan": "harga",
      "emosi": "ragu"
    },
    {
      "speaker": "sales",
      "text": "Percaya saja sama saya, dijamin tidak nyesel, sudah banyak yang beli.",
      "teknik": "atasi_keberatan",
      "kualitas": "lemah"
    },
    {
      "speaker": "pelanggan",
      "text": "Oke deh, itu poin yang bagus.",
      "keberatan": null,
      "emosi": "netral"
    },
    {
      "speaker": "sales",
      "text": "Kalau tidak ada yang mengganjal lagi, boleh saya bantu lanjutkan ke proses administrasi, Bu?",
      "teknik": "closing",
      "kualitas": "baik"
    },
    {
      "speaker": "pelanggan",
      "text": "Yaudah kalau cicilannya masuk, saya jadi.",
      "keberatan": null,
      "emosi": "tertarik"
    },
    {
      "speaker": "sales",
      "text": "Beli wadah penyimpan makanan set juga dong, mumpung di sini, nambah sedikit doang kok.",
      "teknik": "upsell",
      "kualitas": "lemah"
    }
  ]
}