{
  "scenario_id": "elektronik_spek_bingung_24",
  "bidang": "elektronik",
  "produk": "smartphone mid-range",
  "persona": {
    "tipe": "buru_buru",
    "emosi_awal": "tidak_sabar"
  },
  "grounding": {
    "framework": [
      "SPIN",
      "AIDA",
      "FAB",
      "objection-handling"
    ],
    "generator": "grounded-local-v2",
    "divalidasi_manusia": false
  },
  "turns": [
    {
      "speaker": "sales",
      "text": "Halo Kak, apa kabar? Silakan, kalau ada yang menarik nanti saya jelaskan detailnya ya.",
      "teknik": "sapa_rapport",
      "kualitas": "baik"
    },
    {
      "speaker": "pelanggan",
      "text": "Ini lagi lihat-lihat smartphone mid-range yang cocok untuk anak sekolah untuk belajar online.",
      "keberatan": null,
      "emosi": "tidak_sabar"
    },
    {
      "speaker": "sales",
      "text": "Pokoknya smartphone mid-range ini paling laku, langsung ambil aja deh.",
      "teknik": "gali_kebutuhan",
      "kualitas": "lemah"
    },
    {
      "speaker": "pelanggan",
      "text": "Oh begitu.",
      "keberatan": null,
      "emosi": "netral"
    },
    {
      "speaker": "sales",
      "text": "Nah untuk kebutuhan tadi, smartphone mid-range ini pas: kameranya sudah ada OIS jadi hasil foto malam tetap tajam tidak gampang blur. Jadi langsung menjawab yang Bapak/Ibu butuhkan.",
      "teknik": "presentasi_manfaat",
      "kualitas": "baik"
    },
    {
      "speaker": "pelanggan",
      "text": "Saya bingung bedanya sama yang tipe satunya.",
      "keberatan": "mau_pikir_pikir",
      "emosi": "ragu"
    },
    {
      "speaker": "sales",
      "text": "Pertanyaan yang bagus, Kak. Justru di situ bedanya: intinya bedanya cuma di dua hal yang berpengaruh ke pemakaian Bapak/Ibu, sisanya sama saja.",
      "teknik": "atasi_keberatan",
      "kualitas": "baik"
    },
    {
      "speaker": "pelanggan",
      "text": "Oke oke, paham. Lanjut.",
      "keberatan": null,
      "emosi": "tertarik"
    },
    {
      "speaker": "pelanggan",
      "text": "Tapi tetap agak mahal ya.",
      "keberatan": "harga",
      "emosi": "ragu"
    },
    {
      "speaker": "sales",
      "text": "Wajar banget dipikirkan. Kenyataannya, bisa dicicil ringan atau ada tipe yang lebih ramah budget dengan fungsi mirip, dan itu bisa Bapak/Ibu buktikan sendiri.",
      "teknik": "atasi_keberatan",
      "kualitas": "baik"
    },
    {
      "speaker": "pelanggan",
      "text": "Oke oke, paham. Lanjut.",
      "keberatan": null,
      "emosi": "netral"
    },
    {
      "speaker": "sales",
      "text": "Kalau tidak ada yang mengganjal lagi, boleh saya bantu lanjutkan ke proses administrasi, Kak?",
      "teknik": "closing",
      "kualitas": "baik"
    },
    {
      "speaker": "pelanggan",
      "text": "Yaudah gas, saya ambil.",
      "keberatan": null,
      "emosi": "tertarik"
    }
  ]
}