{
  "scenario_id": "elektronik_garansi_05",
  "bidang": "elektronik",
  "produk": "kulkas 2 pintu",
  "persona": {
    "tipe": "cuma_lihat",
    "emosi_awal": "santai"
  },
  "grounding": {
    "framework": [
      "SPIN",
      "AIDA",
      "FAB",
      "objection-handling"
    ],
    "generator": "grounded-local-v2",
    "divalidasi_manusia": false
  },
  "turns": [
    {
      "speaker": "sales",
      "text": "Selamat datang, Mbak. Saya Bima, siap bantu. Lagi cari-cari kulkas 2 pintu ya?",
      "teknik": "sapa_rapport",
      "kualitas": "baik"
    },
    {
      "speaker": "pelanggan",
      "text": "Ini lagi lihat-lihat kulkas 2 pintu yang cocok untuk keluarga yang belanja stok mingguan.",
      "keberatan": null,
      "emosi": "santai"
    },
    {
      "speaker": "sales",
      "text": "Boleh cerita sedikit kebiasaan pemakaiannya? Dari situ saya bisa bantu pilihkan yang tidak mubazir.",
      "teknik": "gali_kebutuhan",
      "kualitas": "baik"
    },
    {
      "speaker": "pelanggan",
      "text": "Iya, betul.",
      "keberatan": null,
      "emosi": "netral"
    },
    {
      "speaker": "sales",
      "text": "Nah untuk kebutuhan tadi, kulkas 2 pintu ini pas: hemat listrik dengan kompresor inverter yang bergaransi sampai 10 tahun. Jadi langsung menjawab yang Bapak/Ibu butuhkan.",
      "teknik": "presentasi_manfaat",
      "kualitas": "baik"
    },
    {
      "speaker": "pelanggan",
      "text": "Kalau rusak nanti garansinya gimana?",
      "keberatan": "ragu_kualitas",
      "emosi": "ragu"
    },
    {
      "speaker": "sales",
      "text": "Saya paham kekhawatiran Bapak/Ibu. Banyak pelanggan awalnya berpikir sama, sampai tahu bahwa prosedur klaimnya cukup bawa unit dan kartu, sisanya kami yang bantu urus.",
      "teknik": "atasi_keberatan",
      "kualitas": "baik"
    },
    {
      "speaker": "pelanggan",
      "text": "Oke deh, itu poin yang bagus.",
      "keberatan": null,
      "emosi": "tertarik"
    },
    {
      "speaker": "pelanggan",
      "text": "Tapi tetap agak mahal ya.",
      "keberatan": "harga",
      "emosi": "ragu"
    },
    {
      "speaker": "sales",
      "text": "Wajar banget dipikirkan. Kenyataannya, bisa dicicil ringan atau ada tipe yang lebih ramah budget dengan fungsi mirip, dan itu bisa Bapak/Ibu buktikan sendiri.",
      "teknik": "atasi_keberatan",
      "kualitas": "baik"
    },
    {
      "speaker": "pelanggan",
      "text": "Oke deh, itu poin yang bagus.",
      "keberatan": null,
      "emosi": "netral"
    },
    {
      "speaker": "sales",
      "text": "Menurut saya ini sudah paling sesuai kebutuhan tadi. Lanjut ke langkah berikutnya, Mbak?",
      "teknik": "closing",
      "kualitas": "baik"
    },
    {
      "speaker": "pelanggan",
      "text": "Yaudah deh, boleh lihat lebih lanjut.",
      "keberatan": null,
      "emosi": "tertarik"
    },
    {
      "speaker": "sales",
      "text": "Sekalian, mau saya tambahkan layanan antar plus buang kulkas lama gratis? Lumayan buat jaga-jaga dan menambah kenyamanan, cuma sedikit tambahan.",
      "teknik": "upsell",
      "kualitas": "baik"
    }
  ]
}