{
  "scenario_id": "otomotif_bandingkan_merk_13",
  "bidang": "otomotif",
  "produk": "SUV compact",
  "persona": {
    "tipe": "sensitif_harga",
    "emosi_awal": "hati_hati"
  },
  "grounding": {
    "framework": [
      "SPIN",
      "AIDA",
      "FAB",
      "objection-handling"
    ],
    "generator": "grounded-local-v2",
    "divalidasi_manusia": false
  },
  "turns": [
    {
      "speaker": "sales",
      "text": "Selamat datang. Lagi cari SUV compact nih, Mbak? Biar tidak salah pilih, saya bantu sesuaikan dengan kebutuhannya ya.",
      "teknik": "sapa_rapport",
      "kualitas": "baik"
    },
    {
      "speaker": "pelanggan",
      "text": "Kebetulan lagi cari SUV compact nih. Saya lagi timbang-timbang sama merk lain juga nih.",
      "keberatan": "bandingkan_kompetitor",
      "emosi": "hati_hati"
    },
    {
      "speaker": "sales",
      "text": "Sekarang lagi pakai yang seperti apa? Ada yang kurang sreg dari yang sekarang, biar saya carikan solusinya?",
      "teknik": "gali_kebutuhan",
      "kualitas": "baik"
    },
    {
      "speaker": "pelanggan",
      "text": "Ya kira-kira begitu.",
      "keberatan": null,
      "emosi": "netral"
    },
    {
      "speaker": "sales",
      "text": "Nah untuk kebutuhan tadi, SUV compact ini pas: posisi duduknya tinggi jadi pandangan luas dan lebih santai saat macet panjang. Jadi langsung menjawab yang Bapak/Ibu butuhkan.",
      "teknik": "presentasi_manfaat",
      "kualitas": "baik"
    },
    {
      "speaker": "pelanggan",
      "text": "Ya sudah kalau begitu.",
      "keberatan": null,
      "emosi": "netral"
    },
    {
      "speaker": "sales",
      "text": "Saya mengerti maksud Bapak/Ibu. Izinkan saya luruskan: kalau dibandingkan berdampingan, fitur keselamatan dan garansinya beda kelas.",
      "teknik": "atasi_keberatan",
      "kualitas": "baik"
    },
    {
      "speaker": "pelanggan",
      "text": "Hmm boleh juga.",
      "keberatan": null,
      "emosi": "tertarik"
    },
    {
      "speaker": "pelanggan",
      "text": "Cuma budget saya agak mepet sih.",
      "keberatan": "harga",
      "emosi": "ragu"
    },
    {
      "speaker": "sales",
      "text": "Saya mengerti maksud Bapak/Ibu. Izinkan saya luruskan: bisa dicicil ringan atau ada tipe yang lebih ramah budget dengan fungsi mirip.",
      "teknik": "atasi_keberatan",
      "kualitas": "baik"
    },
    {
      "speaker": "pelanggan",
      "text": "Ya sudah kalau begitu.",
      "keberatan": null,
      "emosi": "netral"
    },
    {
      "speaker": "sales",
      "text": "Mumpung saya baik nih Mbak, ambil sekarang ya, jangan ditunda-tunda.",
      "teknik": "closing",
      "kualitas": "lemah"
    },
    {
      "speaker": "pelanggan",
      "text": "Oke, kalau harganya segitu saya ambil.",
      "keberatan": null,
      "emosi": "tertarik"
    },
    {
      "speaker": "sales",
      "text": "Supaya lebih tenang pemakaiannya, roof rack untuk barang touring bisa saya bundling dengan harga lebih baik. Mau?",
      "teknik": "upsell",
      "kualitas": "baik"
    }
  ]
}