{
  "scenario_id": "elektronik_garansi_11",
  "bidang": "elektronik",
  "produk": "TV LED 43 inch",
  "persona": {
    "tipe": "cuma_lihat",
    "emosi_awal": "santai"
  },
  "grounding": {
    "framework": [
      "SPIN",
      "AIDA",
      "FAB",
      "objection-handling"
    ],
    "generator": "grounded-local-v2",
    "divalidasi_manusia": false
  },
  "turns": [
    {
      "speaker": "sales",
      "text": "Selamat datang, Bu. Lagi cari TV LED 43 inch untuk keperluan apa? Biar saya bantu carikan yang pas.",
      "teknik": "sapa_rapport",
      "kualitas": "baik"
    },
    {
      "speaker": "pelanggan",
      "text": "Saya lagi lihat TV LED 43 inch nih. Kalau rusak nanti garansinya gimana?",
      "keberatan": "ragu_kualitas",
      "emosi": "santai"
    },
    {
      "speaker": "sales",
      "text": "Rencananya dipakai berapa orang biasanya? Dan lebih sering dalam kota atau jarak jauh?",
      "teknik": "gali_kebutuhan",
      "kualitas": "baik"
    },
    {
      "speaker": "pelanggan",
      "text": "Paham-paham.",
      "keberatan": null,
      "emosi": "netral"
    },
    {
      "speaker": "sales",
      "text": "Kalau begitu ini cocok. Sudah bergaransi resmi panel 2 tahun, bukan sekadar garansi toko. Artinya sehari-hari pemakaiannya lebih tenang.",
      "teknik": "presentasi_manfaat",
      "kualitas": "baik"
    },
    {
      "speaker": "pelanggan",
      "text": "Oke, saya jadi lebih ngerti.",
      "keberatan": null,
      "emosi": "netral"
    },
    {
      "speaker": "sales",
      "text": "Terima kasih sudah jujur, Bu. Nah, ketersediaan sparepart-nya terjamin karena merek ini punya jaringan resmi di seluruh Indonesia, jadi bisa lebih tenang mempertimbangkannya.",
      "teknik": "atasi_keberatan",
      "kualitas": "baik"
    },
    {
      "speaker": "pelanggan",
      "text": "Hmm boleh juga.",
      "keberatan": null,
      "emosi": "tertarik"
    },
    {
      "speaker": "pelanggan",
      "text": "Cuma budget saya agak mepet sih.",
      "keberatan": "harga",
      "emosi": "ragu"
    },
    {
      "speaker": "sales",
      "text": "Terima kasih sudah jujur, Bu. Nah, bisa dicicil ringan atau ada tipe yang lebih ramah budget dengan fungsi mirip, jadi bisa lebih tenang mempertimbangkannya.",
      "teknik": "atasi_keberatan",
      "kualitas": "baik"
    },
    {
      "speaker": "pelanggan",
      "text": "Hmm boleh juga.",
      "keberatan": null,
      "emosi": "netral"
    },
    {
      "speaker": "sales",
      "text": "Biar pas, Bapak/Ibu lebih nyaman ambil yang ini atau yang tadi satunya? Saya siapkan yang dipilih.",
      "teknik": "closing",
      "kualitas": "baik"
    },
    {
      "speaker": "pelanggan",
      "text": "Yaudah deh, boleh lihat lebih lanjut.",
      "keberatan": null,
      "emosi": "tertarik"
    },
    {
      "speaker": "sales",
      "text": "Supaya lebih tenang pemakaiannya, bracket dinding + pemasangan rapi bisa saya bundling dengan harga lebih baik. Mau?",
      "teknik": "upsell",
      "kualitas": "baik"
    }
  ]
}